Charotar University of Science and Technology (CHARUSAT),Charotar University of Science and Technology (CHARUSAT),https://hackday.mlh.io/CHARUSAT University
E. W. Thurston Middle School,"850 High Street, Westwood, MA, United States",https://hackday.mlh.io/localhackday-westwood
Guatemala,"Facultad de Ingeniería, Salones 013 y 014, Edificio T3, Campus Central USAC, Zona 12. Guatemala",https://hackday.mlh.io/localhackday-318e
CAW Student Centre,"CAW Student Centre, Windsor, ON, Canada",https://hackday.mlh.io/University of Windsor
Student Activity Center,"2201 Speedway, Austin, TX 78712",https://lhd.freetailhackers.com
Lancaster University,"Room B69, Faculty of Science and Technology, Fylde Avenue, Lancaster, LA1 4YR, United Kingdom",https://hackday.mlh.io/localhackday-79e9
TBD,TBD,https://hackday.mlh.io/localhackday-e470
"Seminar Hall Oriental College Of Technology,Bhopal","Oriental Group Of College,Seminar Hall Oriental College Of Technology,Bhopal","https://hackday.mlh.io/Oriental College Of Technology,Bhopal"
Fulton Hall,"Fulton Hall, Chestnut Hill, Newton, MA 02467, United States",https://hackday.mlh.io/Boston College
Farmingdale State College,"2350 Broadhollow Rd, Farmingdale, NY 11735, United States",https://hackday.mlh.io/localhackday-0026
Instituto Tecnolgico de Puebla," Avenida Tecnolgico 420, Maravillas, 72220 Puebla, Pue.",https://hackday.mlh.io/localhackday-b868
Devon Energy Hall,,https://hackday.mlh.io/University of Oklahoma
MC125,"MC125, McCrea Building, Royal Holloway, TW20 0LL",https://hackday.mlh.io/rhul
Pray-Harrold,"Pray-Harrold, East Circle Drive, Ypsilanti, MI, United States",https://hackday.mlh.io/emu
Penn State Behrend,"Burke Center 242, 5101 Jordan Rd, Erie, PA 16563",https://hackday.mlh.io/localhackday-57df
201 S Grant Ave,"201 South Grant Avenue, Columbus, OH, United States",https://hackday.mlh.io/localhackday-ee45
Brewster High School,"51 Foggintown Road, Brewster, NY, United States",https://hackday.mlh.io/Brewster High School
ITESM MTY: Pabellon La Carreta,"Eugenio Garza Sada 2501, 64849 Monterrey, N.L., México",https://hackday.mlh.io/localhackday-615f
Local Pri-Hack,Bulevardi i Deshmoreve Prishtine-Bibloteka Kombetare,https://hackday.mlh.io/localhackday-fc6b
BUE,"Suez Rd, EL SHEROUK CITY، Cairo Governorate 11837",https://hackday.mlh.io/bue
"S-1.27, Strand Campus, King's College London","S-1.27, Strand Campus, King's College London, Strand, London WC2R 2LS",https://hackday.mlh.io/kingscollegelondon
Aristotle University of Thessaloniki,"Aristotle University of Thessaloniki, Thessaloniki, Greece",https://hackday.mlh.io/ieeeauthsb
College of Business Administration (Bldg 162),"3801 West Temple Avenue, Pomona, CA, United States",https://hackday.mlh.io/localhackday-044b
Bandwidth Barn (Pty) Ltd,"Bandwidth Barn (Pty) Ltd, Albert Road, Cape Town, South Africa",https://hackday.mlh.io/localhackday-e5c3
"Mathematics, Statistics and Computer Science - Room 203W","Math Sciences, Stillwater, OK, United States",https://hackday.mlh.io/localhackday-9cad
Willcox hall: Friedman Multipurpose Room,Willcox hall: Friedman Multipurpose Room,https://hackday.mlh.io/Pace University Pleasantville Campus
Oxford Academy,"5172 Orange Avenue, Cypress, CA, United States",https://hackday.mlh.io/localhackday-c1fe
"University at Buffalo, Knox 20","University at Buffalo, 20 Knox Hall, Buffalo, NY 14260",https://hackday.mlh.io/University at Buffalo
Instituto Tecnolgico de Morelia,"Avenida Tecnolgico 1500, Lomas de Santiaguito, 58120 Morelia, Mich.Mxico",https://hackday.mlh.io/localhackday-a3d2
Curris Center,"Curris Center, Cs-1075, Murray, KY 42071, United States",https://hackday.mlh.io/murraystate
Adi Shankara Institute of Engineering and Technology,"Adi Shankara Institute of Engineering and Technology, Mattoor, Kalady, Kerala, India",https://hackday.mlh.io/localhackdayadi
Larry Sears and Sally Zlotnick Sears think[box],"11201 Cedar Avenue, Cleveland, OH, United States",https://hackday.mlh.io/localhackday-8d49
GoMyCode,"GoMyCode Hackerspace, 2nd floor, NEO Building, Lac Lochness Street, Lac 1, Tunis, Tunisia ",https://hackday.mlh.io/gomycode
,CardinalCon,https://hackday.mlh.io/Saginaw Valley State University
MP Primary & ZP High School by Cyient Foundation," Gachibowli - Miyapur Rd, Chhota Anjaiah Nagar, Gachibowli, Hyderabad, Telangana 500032",https://hackday.mlh.io/localhackday-0292
1033 Springfield Ave,"1033 Springfield Avenue, Cranford, NJ, United States",https://hackday.mlh.io/localhackday-3a96
Divergence Academy,"14683 Midway Road, Ste. 145 Addison, TX  75001",https://hackday.mlh.io/localhackday-divergence
"Goldsmiths, University of London","Goldsmiths, University of London, New Cross, London, SE14 6NW","https://hackday.mlh.io/Goldsmiths, University of London"
Spotify HQ,"Spotify AB, Birger Jarlsgatan 61, 113 56 Stockholm, Sweden",https://hackday.mlh.io/localhackday-828b
Meshel Hall,"Meshel Hall, 422 Wick Ave, Youngstown, OH 44503",https://hackday.mlh.io/YSU
WPI Atwater Kent 219,"WPI, Atwater Kent Room 219",https://hackday.mlh.io/localhackday-00bd
Universit Abou Bekr Belkaid le Chetouane,"Universit Abou Bekr Belkaid le Chetouane, Chetouane, Algrie",https://hackday.mlh.io/localhackday-f3f4
Startup Depot,"Vesniana Street, 4, Lviv, Lviv region, Ukraine, 79000",https://hackday.mlh.io/Startup Depot
#REF!,"2830 Rutford Ave, Richardson, TX, United States",
Belhaven University,"1500 Peachtree Street, Jackson, MS, United States",
The Cave (Hill Center Room 252),"110 Frelinghuysen Rd, Piscataway Township, NJ 08854, United States",
Hack Volusia,Hack Volusia,https://hackday.mlh.io/UCF Business Incubator
Centennial Collegiate Vocational Institute,Centennial Collegiate Vocational Institute,https://hackday.mlh.io/spartahacks2
New Olin Hall,New Olin Hall,https://hackday.mlh.io/Rose-Hulman Institute of Technology
Computing Science Centre at University of Alberta,"8900 114 St NW, Edmonton, AB, Canada",https://
Informatics @ NKU,"Griffin Hall, Northern Kentucky University",https://hackday.mlh.io/localhackday-dbb1
Engineering Common Room - McGill University,"3480 Rue University, Montréal, QC H3A 0E9",https://hackday.mlh.io/localhackday-2aab
Coding Dojo Seattle,"10777 Main Street, Bellevue, WA, United States",https://hackday.mlh.io/localhackday-59e8
SKIT Jaipur,"CSE main block, Swami Keshvanand Institute of Technology Management & Gramothan, jaipur",https://hackday.mlh.io/localhackday-6a3a
TR10 building ESEIAAT Faculty,TR10 building ESEIAAT Faculty,https://hackday.mlh.io/hackseiaat
#N/A,"Hugh Dempster Pavilion, 6245 Agronomy Rd, Vancouver, BC V6T 1Z4, Canada",
Patio Room,"Patio Room, Queens, NY, United States","https://hackday.mlh.io/Queens College, CUNY, New York City"
704 J St,"704 J Street, San Diego, CA, United States",https://hackday.mlh.io/learnacademy
Postlight Studios,Postlight Studios,https://hackday.mlh.io/Postlight Studios
Silverstone UTC,"Silverstone UTC, Silverstone Circuit, Silverstone, United Kingdom",https://hackday.mlh.io/SilverstoneUTC
New Classroom Building,"1455 Perry St, Blacksburg, VA 24060, United States",https://hackday.mlh.io/localhackday-0447
#N/A,"Av. Catalunya, 35, Tarragona, España",
Galvanize,"515 East Grant Street, Phoenix, AZ, United States",https://hackday.mlh.io/localhackday-6410
Idea Forge,Idea Forge,https://hackday.mlh.io/University of Colorado Boulder
Caolan McKendry,"16 Shelton Road, Armoy",https://hackday.mlh.io/localhackday-6a72
"Avery Hall, UNL -- Rooms 347 and 348","1144 T St, Lincoln, NE 68588",https://hackday.mlh.io/localhackdayUNL
Featheringill Hall Room 134,"400 24th Ave S, Nashville, TN 37212",https://hackday.mlh.io/localhackday-6db0
Coding Blocks,"Coding Blocks, Sector 19, Dwarka, Delhi, India",https://hackday.mlh.io/localhackday-4098
Bronx High School of Science,Bronx High School of Science,https://hackday.mlh.io/Bronx High School of Science
Golisano College of Computing and Information Sciences,"20 Lomb Memorial Dr, Rochester, NY 14623, United States",https://hackday.mlh.io/Rochester Institute of Technology
StartUP FIU Innovation Hub - MARC 3rd Floor,StartUP FIU Innovation Hub - MARC 3rd Floor,https://hackday.mlh.io/Florida International University
Duthie Center for Engineering,Duthie Center for Engineering,https://hackday.mlh.io/University of Louisville
University of Guelph,"University of Guelph, Guelph, ON, Canada",https://hackday.mlh.io/UofGlocalhackday
SERC 1013,255 7th Ave,https://hackday.mlh.io/localhackday-4282
Student Academic Services Building,"1201 West University Drive, Edinburg, TX, United States",https://hackday.mlh.io/localhackday-1c32
"Vulytsya Chornovola, 59","Vulytsya Chornovola 59, Lviv Oblast, Ukraina",https://hackday.mlh.io/localhackday-e952
Lone Star College Cy-Fair,"9191 Barker Cypress Road, Cypress, TX, United States",https://hackday.mlh.io/localhackday-860d
Shopify Toronto,Shopify Toronto,https://localhackday.tech
Bahen Center for IT,"40 St George St, Toronto, ON, Canada",https://hackday.mlh.io/localhackday-4808
Queen Mother Building,"Nethergate, Dundee DD1 4HN",https://hackday.mlh.io/localhackday-2216
Craft Academy - Africa,"4 Burger Avenue, Centurion, South Africa",https://hackday.mlh.io/localhackday-1368
University Institute of Engineering & Technology,"UIET, Chandigarh, India",https://hackday.mlh.io/localhackday-bc93
TK2 Coding Bootcamp,"1515 N Federal Hwy, Boca Raton, FL, United States",https://hackday.mlh.io/localhackday-3abe
Kinsley,"441 Country Club Road, York, PA, United States",https://hackday.mlh.io/localhackday-9734
Shah-E-Alam Darwaja,Shah-E-Alam Darwaja,https://hackday.mlh.io/Navi Gujarati Higher Secondary School
175 E Olive Ave,"175 East Olive Avenue 3rd floor, Burbank, CA, United States",https://hackday.mlh.io/localhackday-8414
Auditorio Heber Soto Fierro,"Av Tecnologico 1500, Lomas de Santiaguito, Morelia",https://hackday.mlh.io/localhackday-18db
Awesome Inc,"348 E Main St, Lexington, KY 40507",https://hackday.mlh.io/lexington
ITESM Campus Monterrey,"ITESM Campus Monterrey, Avenida Eugenio Garza Sada Sur, Tecnológico, Monterrey, Mexico",https://hackday.mlh.io/localhackday-c869
Elizabeth Hall,"Elizabeth Hall, North Woodland Boulevard, DeLand, FL, United States",https://hackday.mlh.io/localhackday-7041
Cory Hall,"Cory Hall, Berkeley, CA 94720",https://hackday.mlh.io/localhackday-b4c5
University of San Diego,"University of San Diego, San Diego, CA, United States",https://hackday.mlh.io/localhackday-3380
"Room 406 Babbage, Plymouth University","Room 406 Babbage Building, Plymouth University, Drake Circus, Plymouth, Devon PL4 8AA",https://hackday.mlh.io/localhackday-11b2
Pedro Arrupe Multipurpose room,"Arrupe Hall, Georgetown University, 3700 O St, NW, Washington, DC",https://hackday.mlh.io/localhackday-51c0
Bisdorf Building,"5000 Dawes Avenue, Alexandria, VA, United States",https://hackday.mlh.io/localhackday-31b4
#REF!,"557 East Fordham Road, Bronx, NY, United States",
"Redmond, WA",Still working on the venue,https://hackday.mlh.io/localhackday-4ad0
City University London,"Northampton Square Garden, Clerkenwell, London EC1V 0HB, UK",https://hackday.mlh.io/City University of London
#REF!,"Brook Avenue, Edgware, United Kingdom",
"Lab 17, Computer Technology Centre (Old Dove Building)","Computer Technology Centre ,  Karunya University",https://hackday.mlh.io/Karunya University
Openlab,"Openlab, Valhallavägen 79, Stockholm, Sverige",https://hackday.mlh.io/localhackday-d18d
UMBC Information Technology and Engineering (ITE) Building,"UMBC Information Technology and Engineering (ITE) Building, Hilltop Road, Baltimore, MD, United States",https://hackday.mlh.io/localhackday-c51f
Benton Hall,"Benton Hall, Oxford, OH, United States",https://hackday.mlh.io/Miami University
The Fridge - Kent State University Library,"1125 Risman Drive, Kent, OH, United States",https://hackday.mlh.io/localhackday-6f6c
Appleton Tower,"11 Crichton Street, Edinburgh, United Kingdom",https://hackday.mlh.io/localhackday-0e49
7800 York Rd,"7800 York Road, Towson, MD, United States",https://hackday.mlh.io/Towson University
Nordmetall lounge,"College Ring 3, Bremen, Germany",https://hackday.mlh.io/localhackday-6034
Nethken Hall,"501 Dan Reneau Dr, Ruston, LA, United States",https://hackday.mlh.io/localhackday-9f60
CSE Club Scientifique de l'ESI,"CSE Club Scientifique de l'ESI, Bab Ezzouar, Algiers Province, Algeria",https://hackday.mlh.io/CSE
3551 Cullen Blvd,"3551 Cullen Blvd, Houston, TX 77204, United States",https://hackday.mlh.io/localhackday-c334
Faculty Of Engineering - Helwan University,"1 Mostafa Fahmy, Helwan Sharkeya, Qism Helwan, Cairo Governorate, Egypt",https://hackday.mlh.io/IEEEHSBlocalhackday
UCL,University College London,https://hackday.mlh.io/localhackday-a1c9
John Jay College of Criminal Justice,"524 W 59th St, New York, NY 10019",https://hackday.mlh.io/johnjay
Curtis Laws Wilson Library Room 202,"400 W 14th St, Rolla, MO 65409",https://hackday.mlh.io/MST
1 W University Blvd,"1 West University Boulevard, Brownsville, TX, United States",https://hackday.mlh.io/localhackday-e3ec
Algoma University,"Algoma University, Queen Street East, Sault Ste. Marie, ON, Canada",https://hackday.mlh.io/Algoma University
E3-270,E3-270,https://hackday.mlh.io/University of Manitoba
Auditorium. Jaipur Engineering College And Research Center,"Jaipur Engineering College And Research Center, Tonk Road, Jaipur",https://hackday.mlh.io/Jaipur Engineering College And Research Center
Simmons College,"300 Fenway, Boston, MA, United States",https://hackday.mlh.io/localhackday-915a
The Shed,The Shed ,https://hackday.mlh.io/ManchesterMetropolitanUniversity
Pakhuis Noorderhaven,Pakhuis Noorderhaven,https://hackday.mlh.io/Hackjeplek
TBD,TBD,https://hackday.mlh.io/localhackday-4d27
Rumson-Fair Haven Regional High School,"74 Ridge Rd, Rumson, NJ 07760",https://hackday.mlh.io/localhackday-2fa4
"Computer Science Building, Room 1240","1210 W Dayton St, Madison, WI, United States Rm 1240",https://hackday.mlh.io/MadHacks
"Conference Room, UNITEC","Boulevard Kennedy, zona Jacaleapa, frente a Residencial Honduras. ",https://hackday.mlh.io/localhackday-b396
#REF!,"Level 2, 7 Kelly Street, Ultimo, NSW 2007",
#REF!,"120 Brunswick Street, Fortitude Valley, QLD 4006",
#REF!,"Level 13, 120 Spencer Street, Melbourne, VIC 3000",
,Strome Entrepreneurial Center,https://hackday.mlh.io/ODU
475 Round Hill Rd,"475 Round Hill Road, Roslyn Heights, NY, United States",https://hackday.mlh.io/Roslyn High School
200 University Ave W,"200 University Avenue West, Waterloo, ON, Canada",https://hackday.mlh.io/uwlocalhackday2017
Seamans Center,"Seamans Center, Iowa City, IA, United States",https://hackday.mlh.io/localhackday-b2bc
IES Deltebre,"Institut Deltebre, Avinguda Catalunya, Deltebre, España",https://hackday.mlh.io/localhackday-4694
Old Computer Science Building Room 2120,"100 Nicolls Rd, Stony Brook, NY 11794",https://hackday.mlh.io/Stony Brook University
Laguna Hills High School,"25401 Paseo De Valencia, Laguna Hills, CA 92653",https://hackday.mlh.io/Laguna Hills High School
Ridge Hacks II,"1123 Glenashton Dr, Oakville, ON L6H 5M1",https://hackday.mlh.io/localhackday-a732
Rudigo,"Pavilion lodge, Alakahia , upstairs ",https://hackday.mlh.io/localhackday-de02
constantine 2 abdelhamid mehri university,"La Nouvelle Ville Ali Mendjeli, Constantine, Algéria",https://hackday.mlh.io/localhackday-98e7
,Student Services Building,https://hackday.mlh.io/University of Western Ontario
Winston Chung Hall - ACM Clubroom,"Winston Chung Hall, Riverside, CA, United States",https://hackday.mlh.io/localhackday-5844
Greater Limassol Area,Atlantidos 14 4532 Limassol Cyprus ,https://hackday.mlh.io/localhackday-6f02
SUB1 Room 3A/3B,"4469 Aquia Creek Ln, Fairfax, VA, United States",https://hackday.mlh.io/gmu17
345 Chambers St,"345 Chambers Street, New York, NY, United States",https://hackday.mlh.io/localhackday-81bd
Coding Blocks Greater Noida,"Coding Blocks Greater Noida, Knowledge Park I, Greater Noida, Uttar Pradesh, India",https://hackday.mlh.io/localhackday-1420
Dehub,Dedan Kimathi Innovation centre,https://hackday.mlh.io/localhackday-80a1
Lawson Computer Science Building,"305 South University Street, West Lafayette, IN 47907, United States",https://hackday.mlh.io/purdue
Centraal,"Zamora 187, Condesa, 06140 Cuauhtémoc, CDMX, Mexico",https://hackday.mlh.io/localhackday-33aa
Mingdao High School," No. 497, Section 1, Zhongshan Road, Wuri District, Taichung City, 41401",https://hackday.mlh.io/hackathonTWjr
Muhandis club,Local muhandis a l'ecole polytechnique d'oran,https://hackday.mlh.io/localhackday-d25a
AGH University of Science and Technology WIEIT,Al. A. Mickiewicza 30 D-17 Pavilon 30-059 Cracow,https://hackday.mlh.io/localhackday-b0f0
The LNM Institute of Information Technology,"The LNM Institute of Information Technology, Rupa Ki Nangal, Via-Jamdoli, Rajasthan, India",https://hackday.mlh.io/The LNM Institute of Information Technology
Delhi Technological University,"Delhi Technological University, Delhi, India",https://hackday.mlh.io/Dlehi Technological University
University of Essex Colchester Campus,"University of Essex Colchester Campus, Colchester, United Kingdom",https://hackday.mlh.io/localhackday-c68d
"Sir Ian Wood Building, Robert Gordon University","Sir Ian Wood Building, Robert Gordon University",https://hackday.mlh.io/rgu-local-hack-day
Norwegian University of Science and Technology (NTNU),"Norwegian University of Science and Technology, Teknologivegen, Gjøvik, Norway",https://hackday.mlh.io/localhackday-1e1d
IST Building,"4700 Research Way, Lakeland, FL, United States",https://hackday.mlh.io/localhackday-a239
Campus Recreation Center Classroom 3200,"2820 Bearcat Way, Classroom 3200, Cincinnati, OH 45221",https://hackday.mlh.io/University of Cincinnati
Princeton High School,Princeton High School,https://hackPHS.tech
DeVry University,"2149 West Dunlap Avenue, Phoenix, AZ, United States",https://hackday.mlh.io/localhackday_Phoenix
University Preparatory School,"2200 Eureka Way, Redding, CA 96001",https://hackday.mlh.io/localhackday-4b52
500 Wilson Blvd,"500 Joseph C Wilson Boulevard, Rochester, NY, United States",https://hackday.mlh.io/localhackday-c9b5
Hillel BC,Hillel BC,https://hackday.mlh.io/localhackdayhackhub
The Diamond,"The Diamond, Leavygreave Road, Sheffield, United Kingdom",https://hackday.mlh.io/sheffield2017
Santa Clara University,500 El Camino Real,https://hackday.mlh.io/Santa Clara University
Bruner Hall Room 207,110 University Drive,https://hackday.mlh.io/localhackday-ttu
Residence Hall West Multipurpose Room(MPR),Residence Hall West Multipurpose Room(MPR),https://hackday.mlh.io/University of Texas at Dallas
Vassar College Rockefeller Hall 310,"124 Raymond Avenue, Poughkeepsie, NY, United States",https://hackday.mlh.io/localhackday-f545
#N/A,"Punto México Conectado, Zona Central, La Paz, Mexico",
#N/A,"BoldTech ICT Services, Tamale, Ghana",
Prime Digital Academy,"301 4th Ave S., #577, Minneapolis, MN 55415",https://hackday.mlh.io/localhackday-2986
"St Esprit, Sir Virgil Naz Avenue, Quatre Bornes, Mauritius","Sir Virgil Naz Avenue, Quatre Bornes, Mauritius",https://mohack.cf
ESTAC,"1201 West University Drive, Edinburg, TX, United States",https://hackday.mlh.io/University of Texas Rio Grande Valley
Lucie Stern,"Lucie Stern Building 5000 MacArthur Blvd. Oakland, CA 94613",https://hackday.mlh.io/localhackday-11ed
Matyas Chlebovsky,"245 Sumner Street, Apt 207",https://hackday.mlh.io/localhackday-3913
Yuvalay Elab,Yuvalay Elab,https://hackday.mlh.io/hackdayvadodara
51 University Blvd E,51 University Blvd E,https://hacks.mbhs.edu
Mediterraneans Co-working space,"11 Zain El-Abedeen, Menyat as Serg, As Sahel, Cairo Governorate","https://hackday.mlh.io/Faculty of Engineering at Shoubra, Benha University"
213 W Institute Pl,"213 West Institute Place #610, Chicago, IL, United States",https://hackday.mlh.io/localhackday-f21d
McAdams Hall,"McMillan Rd, Clemson, SC 29631, United States",https://hackday.mlh.io/localhackday-ab47
DoSelect,"DoSelect - 628/A, 2nd Floor Above Canara Bank, Near BDA Complex Indiranagar 1st Stage Bangalore - 560038",https://hackday.mlh.io/localhackdayblr
Olsson Hall,"2040 Tremont Rd, Charlottesville, VA 22911",https://hackday.mlh.io/localhackday-2778
King's College London,"King's College London, Strand Campus, Strand, London, United Kingdom",https://hackday.mlh.io/localhackday-72a8
Collider,B0214 Chemistry Building,https://hackday.mlh.io/localhackday-e334
Brady Engineering Innovation Center,Brady Engineering Innovation Center,https://hackday.mlh.io/utoledo
IBM Canada Lab (Training Centre: Elm/Willow Room),"8200 Warden Avenue, ON, Canada",https://hackday.mlh.io/localhackday-e719
Fisher Hall,"Fisher Hall, 1400 Townsend Drive, Houghton, MI, United States",https://hackday.mlh.io/localhackday-ad37
Amity University,"Amity University, Noida, Uttar Pradesh, India",https://hackday.mlh.io/localhackday-0f18
Bergen County Academies,Bergen County Academies,https://hackday.mlh.io/Bergen County Academy
"Russ Engineering Center, Wright State University","Russ Engineering Center, Wright State University",https://hackday.mlh.io/Wright State University
Ashesi University College,"Ashesi University College, University Avenue, Berekuso, Ghana",https://hackday.mlh.io/Ashesi University College
TBC,TBC,https://hackday.mlh.io/lborotechsoc
Escola Enginyeria UAB,Escola Enginyeria UAB,https://hackday.mlh.io/Escola_Enginyeria_UAB
91springboard,"91springboard, Plot no C-2 Sector 1, Noida",https://hackday.mlh.io/localhackday-7d8a
Barcelona Code School,"c/ Muntaner 262, 1-1, 08021, Barcelona, Spain",https://hackday.mlh.io/barcelonacodeschool
TBA,TBA,https://hackday.mlh.io/titanhacks
University of Warwick,"University of Warwick, Coventry, United Kingdom",https://hackday.mlh.io/localhackday-c223
Chichester Building I,Chichester Building I ,https://hackday.mlh.io/University of Sussex
Laney College,"900 Fallon Street, Oakland, CA, United States",https://hackday.mlh.io/laneycollege
,Talent Gateway,https://hackday.mlh.io/University of Michigan-Dearborn
City College of New York,"160 Convent Avenue, New York, NY, United States",https://hackday.mlh.io/localhackday-0adf
Instructional Center,"1095 Military Trail, Scarborough, ON, Canada",https://hackday.mlh.io/localhackday-3295
Coding Dojo,"1920 Zanker Road, San Jose, CA, United States",https://hackday.mlh.io/localhackday-92c9
Computer Science Building,"Computer Science Building, Nottingham",https://hackday.mlh.io/localhackday-2f8b
Skurla Hall,Skurla Hall,https://hackday.mlh.io/Florida Institute of Technology
Oakton High School,"2900 Sutton Road, Vienna, VA, United States",https://hackday.mlh.io/Oakton High School
Kirori Mal College,"Kirori Mal College, Delhi, India",https://hackday.mlh.io/localhackday-34c0
Hurley's,"Hurley's Night Club, Lehman Hall, Watertown Dr, Potsdam, NY 13676",https://hackday.mlh.io/localhackday-250d
Universidad CINDEHU Centro de Estudios Superiores,"Calle Fortuna Nacional #113 Colonia José Colomo Villahermosa, Tabasco Mexico 86100",https://hackday.mlh.io/hacktabasco
University of Ontario Institute of Technology,"University of Ontario Institute of Technology, Simcoe Street North, Oshawa, ON, Canada",https://hackday.mlh.io/localhackday-uoit
VCU School Of Engineering West Hall,VCU School Of Engineering West Hall,https://hackday.mlh.io/VCU
Kean University North Avenue Academic Building,"1000 Morris Avenue, Union, NJ, United States",https://hackday.mlh.io/event-gm-de43
Northern India Engineering College,"Northern India Engineering College, Shahdara, Delhi, India",https://hackday.mlh.io/Northern India Engineering college
Coding blocks,"Coding blocks, Vyapar Kendra Road Block C Road, Block C, Gurugram, Haryana, India",https://hackday.mlh.io/localhackday-fdaa
Northern India Engineering College,"Northern India Engineering College, Shahdara, Delhi, India",https://hackday.mlh.io/localhackday-6196
Karond,"Karond, Bhopal, Madhya Pradesh, India",https://hackday.mlh.io/localhackday-5c15
Campus Center-NJIT,150 Bleeker St,https://hackday.mlh.io/New Jersey Institute of Technology
Arbormoon Software,"123 N. Ashley St, Suite 9, Ann Arbor, MI, 48104",https://hackday.mlh.io/annarbor
Hariri Institute for Computing,"111 Cummington Mall, Boston, MA 02215, United States",https://hackday.mlh.io/BULocalHackDay
Carleton University - Canal Building,"1125 Colonel By Drive, Ottawa, ON K1S 5B6, Canada",https://hackday.mlh.io/localhackday-587c
Long Island University,"1 University Plaza, Brooklyn, NY, United States",https://hackday.mlh.io/localhackday-574d
Multimedia University of Kenya,"Multimedia University of Kenya, Nairobi, Kenya",https://hackday.mlh.io/localhackday-15b4
Sheridan College - H131,"7899 McLaughlin Road South, Brampton, ON, Canada",https://hackday.mlh.io/localhackday-59f8
Minerva Schools and Make School Residence Hall - Common Room,851 California Street ,https://hackday.mlh.io/localhackday-c698
MLH LOCAL HACKDAY- Raavi CGHS,"Raavi CGHS, Vikas Puri, New Delhi",https://hackday.mlh.io/localhackday-667f
JK Lakshmipat University,JK Lakshmipat University,https://hackday.mlh.io/jklu
N/A,"Already emailed MLH, venue pending",https://hackday.mlh.io/localhackday-aaac
Chemistry and Computer Science Building,"1828 Hawthorne Street, El Paso, TX, United States",https://hackday.mlh.io/localhackday-1515
CCB Room 257 - Charlton College of Business,UMass Dartmouth 285 ,https://hackday.mlh.io/localhackday-7ab9
"Valley Suite, 3rd fl.","6000 J St. Sacramento, CA",https://hackday.mlh.io/CSUS
"The College of New Jersey, STEM Building 102","The College of New Jersey, STEM Building 102",https://hackday.mlh.io/The College of New Jersey
Howard Gittis Student Center,Howard Gittis Student Center,https://hackday.mlh.io/Temple University
I am working on this,I am working on this,https://hackday.mlh.io/UNCCandWorkshops
