"University School Of Information,Communication and Technology","University School Of Information Communication and Technology, Sector 16 C, Delhi, India",https://hackday.mlh.io/mlhusict
Bennett University,"Bennett University, Greater Noida, Uttar Pradesh, India",https://hackday.mlh.io/localhackday-81d8
Erickson Hall Room 103,"620 Farm Ln, East Lansing, MI, United States",https://hackday.mlh.io/localhackday-ea0a
Frick Impact Academy,"2845 64th Ave, Oakland, CA 94605",https://hackday.mlh.io/localhackday-d27c
Maharaja Surajmal Institute Of Technology,"Maharaja Surajmal Institute Of Technology, New Delhi, Delhi, India",https://hackday.mlh.io/localhackday-c287
ACM,"Washington State University, Pullman, WA, United States",https://hackday.mlh.io/localhackday-86f3
6 MetroTech Center,"6 MetroTech Center, Brooklyn, NY, United States",https://hackday.mlh.io/New York University
Lovely Professional University,"Lovely Professional University, Phagwara, Punjab, India",https://hackday.mlh.io/localhackday-0966
Shiv Nadar University,"Shiv Nadar University, Greater Noida, Uttar Pradesh, India",https://hackday.mlh.io/localhackday-f252
SUNY Albany,SUNY Albany,https://hackday.mlh.io/SUNY Albany
Acton-Boxborough Regional High School,Acton-Boxborough Regional High School,https://hackday.mlh.io/ABRHS
Keele University,Keele University,https://hackday.mlh.io/hackkeele
Manhattan College,"4513 Manhattan College Pkwy, Bronx, NY 10471",https://hackday.mlh.io/localhackday-b344
Coding Dojo Dallas,"900 Jackson Street, Suite #410 Dallas, TX, United States",https://hackday.mlh.io/localhackday-c8f2
"Cal Poly SLO, Advanced Technology Labs","Cal Poly SLO, Advanced Technology Labs",https://hackday.mlh.io/calpoly
Schaumburg High School,"1100 W Schaumburg Rd, Schaumburg, IL 60194",https://hackday.mlh.io/Schaumburg High School
Colorado State University,"Colorado State University, Fort Collins, CO, United States",https://hackday.mlh.io/localhackday-1a22
Aston University,"Aston University, Aston Triangle, Birmingham, B4 7ET",https://hackday.mlh.io/Aston University
Ashoka University,"Ashoka University, Rai, Haryana, India",https://hackday.mlh.io/localhackday-7591
Coding Blocks : Best Programming Courses in New Delhi,"Coding Blocks : Best Programming Courses in New Delhi, Nishant Kunj, Delhi, India",https://hackday.mlh.io/localhackday-7f02
IFPE - Campus Recife,"Av. Prof. Luís Freire, 500 - Cidade Universitária, Recife - PE, 50740-540",https://hackday.mlh.io/localhackday-3ff1
Zahraa Al Maadi,"Zahraa Al Maadi, Cairo-sweis road",https://hackday.mlh.io/localhackday-ff5f
PDS CS Club Local Hack Day,"5800 Sardis Road, Charlotte, NC, United States",https://hackday.mlh.io/localhackday-ea1b
University Of Surrey,"University Of Surrey, Stag Hill, Guildford, United Kingdom",https://hackday.mlh.io/hacksurrey
#REF!,"Stena Center, Holtermansgatan 1, Göteborg, Sverige",
Bandaranayake Mawatha,"Katubedda, Bandaranayake Mawatha, Moratuwa 10400, Sri Lanka",
Jeffrey Hall,Jeffrey Hall,https://hackday.mlh.io/DunningHall
University of Southampton,"Building 32, University of Southampton",https://hackday.mlh.io/soton
East Hall,"820 Washington Avenue North, Madison, SD, United States",https://hackday.mlh.io/localhackday-ffc7
University of Kent,"University of Kent, Canterbury, United Kingdom",https://hackday.mlh.io/localhackday-74bb
Fleetwood Jourdain,"1655 Foster Street, Evanston, IL, United States",https://hackday.mlh.io/localhackday-e7d5
25 University Ave,"25 University Avenue, West Chester, PA, United States",https://hackday.mlh.io/localhackday-9087
"Rowan University, Robinson Hall, 201A/B","201 Mullica Hill Road, Glassboro, NJ, United States",https://hackday.mlh.io/RowanUniversity
1 Grand Ave - Cal Poly,"1 Grand Avenue, San Luis Obispo, CA, United States",https://hackday.mlh.io/localhackday-150a
Iroquois Ridge High School,"Iroquois Ridge High School, Glenashton Drive, Oakville, ON, Canada",https://hackday.mlh.io/Iroquois Ridge High School
Swarthmore College Science Center,"Swarthmore College Science Center, Swarthmore, PA, United States",https://hackday.mlh.io/localhackday-a3b0
Indira Gandhi Delhi Technical University for Women,"Indira Gandhi Delhi Technical University for Women, New Delhi, Delhi, India",https://hackday.mlh.io/localhackday-7bd9
King 223,"10 N Professor St, Oberlin, OH 44074",https://hackday.mlh.io/localhackday-73a4
The Faculty of Technology and Engineering,"The Faculty of Technology and Engineering, Vadodara, Gujarat, India",https://hackday.mlh.io/localhackday-1590
STEM 6 October School -,"STEM October, Ashgar Block, October City, Giza ",https://hackday.mlh.io/localhackday-529c
"The Institute for Applied Health Sciences, McMaster, 1280 Main St W","1280 Main Street West, Hamilton, ON, Canada",https://hackday.mlh.io/McMaster University
